{
  "lesson_id": "demo_001",
  "metadata": {
    "student_name": "Alex Chen",
    "student_age": 10,
    "student_level": "YCT 3",
    "course_type": "Kids Chinese",
    "lesson_topic": "餐厅点餐",
    "lesson_duration_minutes": 45,
    "teacher_name": "Ms. Lin",
    "lesson_date": "2026-07-09",
    "recording_mode": "dual_track",
    "audio_tracks": {
      "teacher": "mock://audio/demo_001/teacher_audio.wav",
      "student": "mock://audio/demo_001/student_audio.wav"
    }
  },
  "transcripts": {
    "teacher": [
      {
        "segment_id": "t_001",
        "speaker": "teacher",
        "start_time": 12.4,
        "end_time": 20.2,
        "text": "Today we are practicing how to order food in Chinese. The key sentence is 我想要...",
        "language_tags": ["en", "zh-CN"],
        "asr_confidence": 0.96
      },
      {
        "segment_id": "t_002",
        "speaker": "teacher",
        "start_time": 26.0,
        "end_time": 33.8,
        "text": "For drinks, we usually use the measure word 杯. Please repeat after me: 我想要一杯果汁。",
        "language_tags": ["en", "zh-CN"],
        "asr_confidence": 0.94
      },
      {
        "segment_id": "t_003",
        "speaker": "teacher",
        "start_time": 45.0,
        "end_time": 51.6,
        "text": "How do you say 'I want a cup of juice' in Chinese?",
        "language_tags": ["en"],
        "asr_confidence": 0.97
      },
      {
        "segment_id": "t_004",
        "speaker": "teacher",
        "start_time": 58.1,
        "end_time": 67.2,
        "text": "Good try. Here we say 一杯果汁, not 一个果汁. 杯 is used for a cup or glass of drink.",
        "language_tags": ["en", "zh-CN"],
        "asr_confidence": 0.95
      },
      {
        "segment_id": "t_005",
        "speaker": "teacher",
        "start_time": 82.3,
        "end_time": 92.5,
        "text": "Because 果汁 is a drink. In Chinese, drinks often use 杯. For noodles, we can say 一碗面条 or 一份面条.",
        "language_tags": ["en", "zh-CN"],
        "asr_confidence": 0.93
      },
      {
        "segment_id": "t_006",
        "speaker": "teacher",
        "start_time": 108.4,
        "end_time": 116.2,
        "text": "Now try a full order: 我想要一杯果汁和一份面条。",
        "language_tags": ["en", "zh-CN"],
        "asr_confidence": 0.94
      },
      {
        "segment_id": "t_007",
        "speaker": "teacher",
        "start_time": 134.0,
        "end_time": 143.8,
        "text": "Nice. After class, please record yourself reading 我想要一杯果汁和一份面条 five times.",
        "language_tags": ["en", "zh-CN"],
        "asr_confidence": 0.92
      },
      {
        "segment_id": "t_008",
        "speaker": "teacher",
        "start_time": 145.1,
        "end_time": 154.6,
        "text": "Also review these words: 杯, 份, 碗, 果汁, 面条, 多少钱.",
        "language_tags": ["en", "zh-CN"],
        "asr_confidence": 0.93
      },
      {
        "segment_id": "t_009",
        "speaker": "teacher",
        "start_time": 168.0,
        "end_time": 176.4,
        "text": "Next lesson, we will practice asking the price with 多少钱 and ordering without spicy food.",
        "language_tags": ["en", "zh-CN"],
        "asr_confidence": 0.95
      }
    ],
    "student": [
      {
        "segment_id": "s_001",
        "speaker": "student",
        "start_time": 35.0,
        "end_time": 38.1,
        "text": "我想要一杯果汁。",
        "language_tags": ["zh-CN"],
        "asr_confidence": 0.91
      },
      {
        "segment_id": "s_002",
        "speaker": "student",
        "start_time": 52.8,
        "end_time": 56.5,
        "text": "我想要一个果汁。",
        "language_tags": ["zh-CN"],
        "asr_confidence": 0.9
      },
      {
        "segment_id": "s_003",
        "speaker": "student",
        "start_time": 70.4,
        "end_time": 74.2,
        "text": "为什么用“杯”？",
        "language_tags": ["zh-CN"],
        "asr_confidence": 0.88
      },
      {
        "segment_id": "s_004",
        "speaker": "student",
        "start_time": 119.6,
        "end_time": 124.4,
        "text": "我想要一杯果汁和一份面条。",
        "language_tags": ["zh-CN"],
        "asr_confidence": 0.89
      },
      {
        "segment_id": "s_005",
        "speaker": "student",
        "start_time": 157.3,
        "end_time": 160.2,
        "text": "多少钱？",
        "language_tags": ["zh-CN"],
        "asr_confidence": 0.86
      }
    ]
  },
  "practice_clips": [
    {
      "clip_id": "clip_001",
      "student_segment_id": "s_001",
      "audio_uri": "mock://audio/demo_001/student_035000_038100.wav",
      "clip_start": 34.7,
      "clip_end": 38.6,
      "reference_text": "我想要一杯果汁",
      "reference_source": "teacher_repeat_instruction",
      "reference_confidence": "high",
      "should_assess_pronunciation": true
    },
    {
      "clip_id": "clip_002",
      "student_segment_id": "s_002",
      "audio_uri": "mock://audio/demo_001/student_052800_056500.wav",
      "clip_start": 52.5,
      "clip_end": 57.0,
      "reference_text": "我想要一杯果汁",
      "reference_source": "teacher_question_expected_answer",
      "reference_confidence": "medium",
      "should_assess_pronunciation": true
    },
    {
      "clip_id": "clip_003",
      "student_segment_id": "s_004",
      "audio_uri": "mock://audio/demo_001/student_119600_124400.wav",
      "clip_start": 119.3,
      "clip_end": 124.9,
      "reference_text": "我想要一杯果汁和一份面条",
      "reference_source": "teacher_model_sentence",
      "reference_confidence": "high",
      "should_assess_pronunciation": true
    },
    {
      "clip_id": "clip_004",
      "student_segment_id": "s_005",
      "audio_uri": "mock://audio/demo_001/student_157300_160200.wav",
      "clip_start": 157.0,
      "clip_end": 160.7,
      "reference_text": "多少钱",
      "reference_source": "course_keyword",
      "reference_confidence": "medium",
      "should_assess_pronunciation": true
    }
  ],
  "pronunciation_assessments": [
    {
      "assessment_id": "pa_001",
      "clip_id": "clip_001",
      "reference_text": "我想要一杯果汁",
      "pronunciation_score": 82,
      "accuracy_score": 80,
      "fluency_score": 86,
      "completeness_score": 100,
      "prosody_score": 78,
      "low_score_words": [
        {
          "word": "果汁",
          "accuracy_score": 66,
          "error_type": "Mispronunciation",
          "note": "模型仅定位到该词发音分较低，具体声母或声调问题需老师确认。"
        }
      ],
      "model_confidence": "medium",
      "teacher_confirmation_required": true
    },
    {
      "assessment_id": "pa_002",
      "clip_id": "clip_002",
      "reference_text": "我想要一杯果汁",
      "pronunciation_score": 74,
      "accuracy_score": 71,
      "fluency_score": 80,
      "completeness_score": 83,
      "prosody_score": 72,
      "low_score_words": [
        {
          "word": "一杯",
          "accuracy_score": 62,
          "error_type": "ReferenceMismatch",
          "note": "学生说成“一个”，该片段更适合用于量词纠错，不应直接解释为发音错误。"
        }
      ],
      "model_confidence": "low",
      "teacher_confirmation_required": true
    },
    {
      "assessment_id": "pa_003",
      "clip_id": "clip_003",
      "reference_text": "我想要一杯果汁和一份面条",
      "pronunciation_score": 79,
      "accuracy_score": 76,
      "fluency_score": 84,
      "completeness_score": 100,
      "prosody_score": 75,
      "low_score_words": [
        {
          "word": "面条",
          "accuracy_score": 69,
          "error_type": "Mispronunciation",
          "note": "建议下节课回听并确认“条”的发音。"
        }
      ],
      "model_confidence": "medium",
      "teacher_confirmation_required": true
    },
    {
      "assessment_id": "pa_004",
      "clip_id": "clip_004",
      "reference_text": "多少钱",
      "pronunciation_score": 84,
      "accuracy_score": 82,
      "fluency_score": 88,
      "completeness_score": 100,
      "prosody_score": 80,
      "low_score_words": [],
      "model_confidence": "medium",
      "teacher_confirmation_required": false
    }
  ],
  "evidence": {
    "knowledge_points": [
      {
        "evidence_id": "ev_kp_001",
        "type": "knowledge_point",
        "source_segment_ids": ["t_001"],
        "timestamp": "00:12",
        "claim": "本节课学习餐厅点餐场景中的“我想要...”句型。",
        "confidence": "high"
      },
      {
        "evidence_id": "ev_kp_002",
        "type": "knowledge_point",
        "source_segment_ids": ["t_002", "t_005"],
        "timestamp": "00:26",
        "claim": "本节课重点学习饮料量词“杯”，并对比“份”“碗”的使用。",
        "confidence": "high"
      },
      {
        "evidence_id": "ev_kp_003",
        "type": "knowledge_point",
        "source_segment_ids": ["t_009", "s_005"],
        "timestamp": "02:37",
        "claim": "学生开始练习询问价格“多少钱”。",
        "confidence": "medium"
      }
    ],
    "teacher_questions": [
      {
        "evidence_id": "ev_tq_001",
        "type": "teacher_question",
        "source_segment_ids": ["t_003"],
        "timestamp": "00:45",
        "claim": "老师提问：How do you say 'I want a cup of juice' in Chinese?",
        "confidence": "high"
      }
    ],
    "student_questions": [
      {
        "evidence_id": "ev_sq_001",
        "type": "student_question",
        "source_segment_ids": ["s_003"],
        "timestamp": "01:10",
        "claim": "学生主动提问为什么用“杯”而不是“个”。",
        "confidence": "high"
      }
    ],
    "corrections": [
      {
        "evidence_id": "ev_cr_001",
        "type": "correction",
        "source_segment_ids": ["s_002", "t_004"],
        "timestamp": "00:52",
        "student_original": "我想要一个果汁",
        "teacher_correction": "一杯果汁",
        "claim": "学生把饮料量词说成“一个”，老师纠正为“一杯果汁”。",
        "confidence": "high"
      }
    ],
    "homework": [
      {
        "evidence_id": "ev_hw_001",
        "type": "homework",
        "source_segment_ids": ["t_007"],
        "timestamp": "02:14",
        "claim": "老师布置录音作业：课后朗读“我想要一杯果汁和一份面条”五遍。",
        "confidence": "high"
      },
      {
        "evidence_id": "ev_hw_002",
        "type": "homework",
        "source_segment_ids": ["t_008"],
        "timestamp": "02:25",
        "claim": "老师布置词汇复习：杯、份、碗、果汁、面条、多少钱。",